,lyrics,title
24,"Letra de ""Felices los 4""[Intro]Maluma baby[Verso 1]Apenas sale el sol y tú te vas corriendoSé que pensarás que esto me está doliendoYo no estoy pensando en lo que estás haciendoSi somos ajenos y así nos queremos[Estribillo 1]Si conmigo te quedasO con otro tú te vasNo me importa un carajoPorque sé que volverásSi conmigo te quedasO con otro tú te vasNo me importa un carajoPorque sé que volverás[Estribillo 2]Y si con otro pasas el ratoVamo' a ser feliz, vamo' a ser felizFelices los 4Te agrandamos el cuartoY si con otro pasas el ratoVamo' a ser feliz, vamo' a ser felizFelices los 4Yo te acepto el trato[Coro]Y lo hacemos otro ratoY lo hacemos otro ratoY lo hacemos otro ratoY lo hacemos otro rato[Verso 2]Y lo hacemos otro ratoLo nuestro no depende de un pactoDisfruta y sólo siente el impactoEl boom boom que te quema, ese cuerpo de sirenaTranquila que no creo en contratos(Y tu menos...)[Puente]Y siempre que se va, regresa a míY felices los 4No importa el que dirán, nos gusta así(Te agrandamos el cuarto, baby)Y siempre que se va, regresa a míY felices los 4No importa el que dirán, somos tal para cual[Estribillo 2]Y si con otro pasas el ratoVamo' a ser feliz, vamo' a ser felizFelices los 4Te agrandamos el cuartoY si con otro pasas el ratoVamo' a ser feliz, vamo' a ser felizFelices los 4Yo te acepto el trato[Coro]Y lo hacemos otro ratoY lo hacemos otro ratoY lo hacemos otro ratoY lo hacemos otro rato[Estribillo 1]Si conmigo te quedasO con otro tú te vasNo me importa un carajoPorque sé que volverásSi conmigo te quedasO con otro tú te vasNo me importa un carajoPorque sé que volverás[Estribillo 2]Y si con otro pasas el ratoVamo' a ser feliz, vamo' a ser felizFelices los 4Te agrandamos el cuartoY si con otro pasas el ratoVamo' a ser feliz, vamo' a ser felizFelices los 4Yo te acepto el trato[Coro]Y lo hacemos otro ratoY lo hacemos otro ratoY lo hacemos otro ratoY lo hacemos otro rato[Outro]Y siempre que se va, regresa a mí(Maluma baby)No importa el que dirán, nos gusta así(Kevin ADG, Chan El Genio)Y siempre que se va, regresa a mí(El código secreto, baby)No importa el que dirán, somos tal para cualAsí lo quiso el destino mamiMua",felices los 4
25,"[Verse 1]I met you in the darkYou lit me upYou made me feel as thoughI was enoughWe danced the night awayWe drank too muchI held your hair back whenYou were throwing up[Pre-Chorus]Then you smiled over your shoulderFor a minute, I was stone cold soberI pulled you closer to my chestAnd you asked me to stay overI said, I already told yaI think that you should get some rest[Chorus 1]I knew I loved you thenBut you'd never know'Cause I played it cool when I was scared of letting goI knew I needed youBut I never showedBut I wanna stay with youUntil we're grey and oldJust say you won't let goJust say you won't let go[Verse 2]I'll wake you up with some breakfast in bedI'll bring you coffeeWith a kiss on your headAnd I'll take the kids to schoolWave them goodbyeAnd I'll thank my lucky stars for that night[Pre-Chorus 2]When you looked over your shoulderFor a minute, I forget that I'm olderI wanna dance with you right now, ohAnd you look as beautiful as everAnd I swear that everyday you'll get betterYou make me feel this way somehow[Chorus 2]I'm so in love with youAnd I hope you knowDarling your love is more than worth its weight in goldWe've come so far my dearLook how we've grownAnd I wanna stay with youUntil we're grey and oldJust say you won't let goJust say you won't let go[Bridge]I wanna live with youEven when we're ghosts'Cause you were always there for meWhen I needed you most[Chorus 3]I'm gonna love you tillMy lungs give outI promise till death we partLike in our vowsSo I wrote this song for youNow everybody knowsThat it's just you and meUntil we're grey and oldJust say you won't let goJust say you won't let go[Outro]Just say you won't let goOh, just say you won't let go",say you won't let go
26,"[Video Intro]Wicked or weakness?You gotta see thisWaaaaay (yeah, yeah!)[Album Intro]Nobody pray for meIt's been that day for meWaaaaay (yeah, yeah!)[Verse 1]Ayy, I remember syrup sandwiches and crime allowancesFinesse a nigga with some counterfeits, but now I'm countin' thisParmesan where my accountant lives, in fact I'm downin' thisD'USSÉ with my boo bae tastes like Kool-Aid for the analystsGirl, I can buy yo' ass the world with my paystubOoh, that pussy good, won't you sit it on my taste bloods?I get way too petty once you let me do the extrasPull up on your block, then break it down: we playin' TetrisA.M. to the P.M., P.M. to the A.M., funkPiss out your per diem, you just gotta hate 'em, funkIf I quit your BM, I still ride Mercedes, funkIf I quit this season, I still be the greatest, funkMy left stroke just went viralRight stroke put lil' baby in a spiralSoprano C, we like to keep it on a high noteIt's levels to it, you and I know[Chorus]Bitch, be humble (hol' up, bitch)Sit down (hol' up, lil', hol' up, lil' bitch)Be humble (hol' up, bitch)Sit down (hol' up, sit down, lil', sit down, lil' bitch)Be humble (hol' up, hol' up)Bitch, sit down (hol' up, hol' up, lil' bitch)Be humble (lil' bitch, hol' up, bitch)Sit down (hol' up, hol' up, hol' up, hol' up)Be humble (hol' up, hol' up)Sit down (hol' up, hol' up, lil', hol' up, lil' bitch)Be humble (hol' up, bitch)Sit down (hol' up, sit down, lil', sit down, lil' bitch)Be humble (hol' up, hol' up)Bitch, sit down (hol' up, hol' up, lil' bitch)Be humble (lil' bitch, hol' up, bitch)Sit down (hol' up, hol' up, hol' up, hol' up)[Verse 2]Who dat nigga thinkin' that he frontin' on Man-Man? (Man-Man)Get the fuck off my stage, I'm the Sandman (Sandman)Get the fuck off my dick, that ain't rightI make a play fucking up your whole lifeI'm so fuckin' sick and tired of the PhotoshopShow me somethin' natural like afro on Richard PryorShow me somethin' natural like ass with some stretch marksStill will take you down right on your mama's couch in Polo socksAyy, this shit way too crazy, ayy, you do not amaze me, ayyI blew cool from AC, ayy, Obama just paged me, ayyI don't fabricate it, ayy, most of y'all be fakin', ayyI stay modest 'bout it, ayy, she elaborate it, ayyThis that Grey Poupon, that Evian, that TED Talk, ayyWatch my soul speak, you let the meds talk, ayyIf I kill a nigga, it won't be the alcohol, ayyI'm the realest nigga after all[Chorus]Bitch, be humble (hol' up, bitch)Sit down (hol' up, lil', hol' up, lil' bitch)Be humble (hol' up, bitch)Sit down (hol' up, sit down, lil', sit down, lil' bitch)Be humble (hol' up, hol' up)Bitch, sit down (hol' up, hol' up, lil' bitch)Be humble (lil' bitch, hol' up, bitch)Sit down (hol' up, hol' up, hol' up, hol' up)Be humble (hol' up, hol' up)Sit down (hol' up, hol' up, lil', hol' up, lil' bitch)Be humble (hol' up, bitch)Sit down (hol' up, sit down, lil', sit down, lil' bitch)Be humble (hol' up, hol' up)Bitch, sit down (hol' up, hol' up, lil' bitch)Be humble (lil' bitch, hol' up, bitch)Sit down (hol' up, hol' up, hol' up, hol' up)",humble.
27,"[Intro: Post Malone]Mm-mmmYah, yahMm-mmmYah (hey)[Chorus: Post Malone]My momma called, seen you on TV, sonSaid shit done changed ever since we was onI dreamed it all ever since I was youngThey said I wouldn't be nothingNow they always say, ""Congratulations"" (uh, uh)Worked so hard, forgot how to vacation (uh-huh)They ain't never had the dedication (uh, uh)People hatin', say we changed and look, we made it (uh, uh)Yeah, we made it (uh, uh)[Verse 1: Post Malone]They was never friendly, yeahNow I'm jumping out the Bentley, yeahAnd I know I sound dramatic, yeahBut I know I had to have it, yeahFor the money, I'm a savage, yeahI be itching like a addict, yeahI'm surrounded, twenty bad bitches, yeahBut they didn't know me last year, yeahEveryone wanna act like they important (yeah, yeah, yeah, yeah, yeah)But all that mean nothing when I saw my dough, yuh (yeah, yeah, yeah, yeah, yeah)Everyone countin' on me, drop the ball, yuh (yeah, yeah, yeah, yeah, yeah)Everything custom like I'm at the border, yah, yahIf you fuck with winning, put your lighters to the skyHow could I make cents when I got millions on my mind?Coming with that bullshit, I just put it to the sideBalling since a baby, they could see it in my eyes[Chorus: Post Malone & Quavo]My momma called, seen you on TV, sonSaid shit done changed ever since we was onI dreamed it all ever since I was youngThey said I wouldn't be nothingNow they always say, ""Congratulations"" (congratulations)Worked so hard, forgot how to vacation (ooh)They ain't never had the dedication (uh, uh, ayy)People hatin', say we changed and look we made it (uh, uh)Yeah, we made it (uh, uh, yah)[Verse 2: Quavo]I was patient (yah)Uh, I was patient (ayy, uh)Now I can scream that we made it (we made it)Now everywhere, everywhere I go, they say 'gratulation (uh)Young nigga, young nigga, graduation (yah)I pick up the rock and I ball, baby (ball)I'm looking for someone to call, baby (brr)But right now, I got a situation (ayy)Never old Ben-Ben Franklins (cash)Big rings, champagne (ooh, champagne)My life is like a ball game (ball game)But instead, I'm in the trap though (trap though)Pot so big, call it Super Bowl (Super Bowl)Super Bowl, call the hoes (brr)Get in the Rolls (skrrt)Top-floor lifestyle (top)Huncho and Post (yah, ayy) Malone (ayy)I gotta play on my phone (ayy)You know what I'm on (ayy)Huncho Houdini is gone (ayy)[Chorus: Post Malone & Quavo]My momma called, seen you on TV, sonSaid shit done changed ever since we was onI dreamed it all ever since I was youngThey said I wouldn't be nothingNow they always say, ""Congratulations"" (ayy, uh, uh)Worked so hard, forgot how to vacation (uh-huh, ooh)They ain't never had the dedication (ayy, uh, uh)People hatin', say we changed and look we made it (yah,  uh, uh)Yeah, we made it (ayy)[Outro]Hey, hey, hey, heyHey, hey, hey, heyHey, hey, hey, heyHey, hey, hey, hey",congratulations
28,"[Verse 1]Just a young gun with a quick fuseI was uptight, wanna let looseI was dreaming of bigger thingsAnd wanna leave my old life behindNot a yessir, not a followerFit the box, fit the moldHave a seat in the foyer, take a numberI was lightning before the thunder[Chorus]Thunder, feel the thunderLightning then the thunderThunder, feel the thunderLightning then the thunderThunder, thunderThunder[Verse 2]Kids were laughing in my classesWhile I was scheming for the massesWho do you think you are?Dreaming 'bout being a big starThey say you're basic, they say you're easyYou're always riding in the backseatNow I'm smiling from the stageWhile you were clapping in the nose bleeds[Chorus]Thunder, feel the thunderLightning then the thunderThunder, feel the thunderLightning then the thunderThunder[Bridge]Thunder, feel the thunderLightning then the thunder, thunder[Chorus]Thunder, feel the thunderLightning then the thunder, thunderThunder, feel the thunderLightning then the thunder, thunderThunder, feel the thunderLightning then the thunder, thunderThunder, feel the thunderLightning then the thunder, thunder",thunder
29,"Letra de Reggaetón Lento (Bailemos)[Verso 1: Erick]Qué bien se veMe trae loco su figuraEse trajecito corto le queda bienCombinado con su lipstick color caféQué bien se veMe hipnotiza su cinturaCuando baila hasta los dioses la quieren verYa no perderé más tiempo, me acercaré[Coro: Todo]Yo sólo la miré y me gustóMe pegué y la invité: “Bailemos, eh?”La noche está para un reggaetón lentoDe esos que no se bailan hace tiempoYo sólo la miré y me gustóMe pegué y la invité: “Bailemos, eh?”La noche está para un reggaetón lentoDe esos que no se bailan hace tiempo[Verso 2: Erick & Zadbiel]Permíteme bailar contigo esta piezaEntre todas las mujeres se resalta tu bellezaMe encanta tu firmeza, te mueves con destrezaMuévete, muévete, muéveteMuy rica, latina, estás llena de vidaSube las dos manos, dale pa´ arriba¿Dónde están las solteras y las que no, también?Sin miedo muévete, muévete, muévete[Coro: Todo]Yo sólo la miré y me gustóMe pegué y la invité: “Bailemos, eh?”La noche está para un reggaetón lentoDe esos que no se bailan hace tiempoYo sólo la miré y me gustóMe pegué y la invité: “Bailemos, eh?”La noche está para un reggaetón lentoDe esos que no se bailan hace tiempo[Pos-Coro: Todo]Baila conmigoLa noche está para un reggaetón lentoDe esos que no se bailan hace tiempo[Puente: Richard]I know you like it when I take you to the floorI know you like this reggaetón lentoThis is happend baby till I say soCome get - come get some more[Verso 3: Zadbiel & Joel]Es imposible atrasar las horasCada minuto contigo es un sueñoQuisiera ser su confidente¿Por qué no te atreves y lo hacemos ahora?No te pongas tímidaEstamos tú y yo a solas[Coro: Todo]Yo sólo la miré y me gustóMe pegué y la invité: “Bailemos, eh?”La noche está para un reggaetón lentoDe esos que no se bailan hace tiempoYo sólo la miré y me gustóMe pegué y la invité: “Bailemos, eh?”La noche está para un reggaetón lentoDe esos que no se bailan hace tiempo[Coro: Todo]Yo sólo la miré y me gustóMe pegué y la invité: “Bailemos, eh?”La noche está para un reggaetón lentoDe esos que no se bailan hace tiempoYo sólo la miré y me gustóMe pegué y la invité: “Bailemos, eh?”La noche está para un reggaetón lentoDe esos que no se bailan hace tiempo[Pos-Coro: Todo]Muévete, muéveteBáilalo, báilaloLa noche está para un reggaetón lentoDe esos que no se bailan hace tiempoMuévete, muéveteBáilalo, báilaloLa noche está para un reggaetón lentoDe esos que no se bailan hace tiempo¿Que quiénes somos?¡CNCO![Outro: Erick]Qué bien se veMe trae loco su figuraEse trajecito corto le queda bienCombinado con su lipstick color caféQué bien se ve",reggaetón lento (bailemos)
30,"[Intro]Ooh, na na yeahDon't act like you know me, like you know me, na na yeahI am not your homie, not your hoe, na na yeahDon't act like you know me, like you know me, na na yeahYou don't know me(""What you-what you gonna do?"")[Verse 1]Oh yeah, time is money so don't fuck with mineSee I'm out with my girls, I'ma have a good timeStep back with your chit-chat, killin' my vibe[Refrain]See, I can't get too much of a good thingS'why me a dressed up in the finest thingsWell, please hold your tongue, oh, don't say a damn thing[Chorus]See your iPhone camera flashin'Please step back, it's my style you're crampin'""You here for long?"" ""Oh no, I'm just passin'""""Do you wanna drink?"" ""Na, thanks for askin'""[Post-Chorus]Ooh, na na yeahDon't act like you know me, like you know me, na na yeahI am not your homie, not your, hoo, na na yeahDon't act like you know me, like you know me, na na yeahYou don't know me, fuck yeahOoh, na na yeahDon't act like you know me, like you know me, na na yeahI am not your homie, not your, hoo, na na yeahDon't act like you know me, like you know me, na na yeahYou don't know me, fuck yeah[Interlude]I mean, we could throw shapes togetherBut it doesn't mean you're in my circle, yeah[Verse 2]Cruise through life and I'm feelin' on trackIf you can't keep up, then you better fall back'Cause money look better when I see it all stacked up[Refrain]See, I can't get too much of a good thingS'why me a dressed up in the finest thingsWell, please hold your tongue, oh, don't say a damn thing[Chorus]See your iPhone camera flashin'Please step back, it's my style you're crampin'""You here for long?"" ""Oh no, I'm just passin'""""Do you wanna drink?"" ""Na, thanks for askin'""[Post-Chorus]Ooh, na na yeahDon't act like you know me, like you know me, na na yeahI am not your homie, not your, hoo, na na yeahDon't act like you know me, like you know me, na na yeahYou don't know me, fuck yeahOoh, na na yeahDon't act like you know me, like you know me, na na yeahI am not your homie, not your, hoo, na na yeahDon't act like you know me, like you know me, na na yeahYou don't know me, fuck yeah[Bridge]Come round here, just know thoughWon't get what you want, what you want, what you want, wantTell you what you don't knowI get what I want, what I want, what I want, want[Chorus]See your iPhone camera flashin'Please step back, it's my style you're crampin'""You here for long?"" ""Oh no, I'm just passin'""""Do you wanna drink?"" ""Na, thanks for askin'""[Post-Chorus]Ooh, na na yeahDon't act like you know me, like you know me, na na yeahI am not your homie, not your, hoo, na na yeahDon't act like you know me, like you know me, na na yeahYou don't know me, fuck yeah[Outro]You don't know me, fuck yeah",you don't know me   radio edit
31,"[Verse 1: Jack]""No thank you"" is what I should've saidI should be in bedBut temptations of trouble on my tongueTroubles yet to come[Pre-Chorus: Jack]One sip, bad for meOne hit, bad for meOne kiss, bad for meBut I give in so easilyAnd ""no thank you"" is how it should've goneI should stay strong[Chorus: All]But I'm weak, and what's wrong with that?Boy, oh boy I love it when I fall for thatI'm weak, and what's wrong with that?Boy, oh boy I love it when I fall for thatI'm weakOoh waaaaaaa ee ya ee yaOoh waaaaaaa ee ya ee yaBut I'm weak, and what's wrong with that?Boy, oh boy I love it when I fall for that(Boy, oh boy I love it when I fall for that)[Verse 2]No thank youThey call me after dark, I don't want no partMy habits, they hold me like a grudgeI promise I won't budge[Pre-Chorus: Jack]One sip, bad for meOne hit, bad for meOne kiss, bad for meBut I give in so easilyAnd ""no thank you"" is how it should've goneI should stay strong[Chorus]But I'm weak, and what's wrong with that?Boy, oh boy I love it when I fall for thatI'm weak, and what's wrong with that?Boy, oh boy I love it when I fall for thatI'm weakOoh waaaaaaa ee ya ee yaOoh waaaaaaa ee ya ee yaBut I'm weak, and what's wrong with that?Boy, oh boy I love it when I fall for that[Bridge]We, we fall for thatWake up, we fall againWe, we fall for thatCan't wait to fall again[Pre-Chorus]One sip, bad for meOne hit, bad for meOne kiss, bad for meBut I give in so easilyAnd no thank you is how it should've goneI should stay strong[Chorus]But I'm weak, and what's wrong with that?Boy, oh boy I love it when I fall for thatI'm weak, and what's wrong with that?Boy, oh boy I love it when I fall for thatI'm weakGo!Ooh waaaaaaa ee ya ee yaOoh waaaaaaa ee ya ee yaBut I'm weak, and what's wrong with that?Boy, oh boy I love it when I fall for thatOoh waaaaaaa ee ya ee yaaaaa",weak
32,"[Verse 1]Got a girl from the south side, got braids in her hairFirst time I seen her walk by, man I 'bout fell off my chairHad to get her number, it took me like six weeksNow me and her go way back like Cadillac seats[Chorus]Body like a back road, drivin' with my eyes closedI know every curve like the back of my handDoin' 15 in a 30, I ain't in no hurryI'ma take it slow just as fast as I can[Verse 2]The way she fit in them blue jeans, she don't need no beltBut I can turn them inside out, I don't need no helpGot hips like honey, so thick and so sweetIt ain't no curves like hers on them downtown streets[Chorus]Body like a back road, drivin' with my eyes closedI know every curve like the back of my handDoin' 15 in a 30, I ain't in no hurryI'ma take it slow just as fast as I can[Bridge]We're out here in the boondocksWith the breeze and the birdsTangled up in the tall grassWith my lips on hersOn the highway to heavenHeaded south of her smileGet there when we get thereEvery inch is a mile[Chorus]Body like a back road, drivin' with my eyes closedI know every curve like the back of my handDoin' 15 in a 30, I ain't in no hurryI'ma take it slow just as fast as I can[Outro]I'ma take it slowAs fast as I canBody like a back roadDrivin' with my eyes closedI know every curve like the back of my hand",body like a back road
33,"[Intro]Are you alright?I'm alright, I'm quite alrightAnd my money's right8… (yeah)Countin' them bandsAll way to the top 'til they be fallin' over(yeah, yeah, yeah)Countin' them bandsOn my way to the top 'til we fallin' over[Chorus]I don't really care if you cryOn the real, you shoulda never liedShoulda saw the way she looked me in my eyesShe said: ""Baby, I am not afraid to die.""Push me to the edgeAll my friends are deadPush me to the edgeAll my friends are deadPush me to the edgeAll my friends are deadPush me to the edge[Verse 1]Phantom that's all red, inside all whiteLike somethin' you ride a sled down, I just want that headMy Brittany got mad, I'm barely her man nowEverybody got the same swag nowWatch the way that I tear it downStackin' my bands all the way to the topAll the way 'til my bands fallin' overEvery time that you leave your spotYour girlfriend call me like, ""Come on over!""I like the way that she treat meGon' leave you, won't leave me, I call it that CasanovaShe say I'm insane, yeahI might blow my brain out (hey)Xanny, help the pain, yeahPlease, Xanny, make it go awayI'm committed, not addicted, but it keep control of meAll the pain, now I can't feel itI swear that it's slowin' me, yeah[Chorus]I don't really care if you cryOn the real, you shoulda never liedSaw the way she looked me in my eyesShe said: ""I am not afraid to die.""All my friends are deadPush me to the edge (yeah)All my friends are dead, yeah, oohPush me to the edgeAll my friends are dead, yeahAll my friends are dead, yeah[Verse 2]That is not your swag, I swear you fake hardNow these niggas wanna take my cadenceRain on 'em, thunderstorm, rain on 'em (ooh, yeah)Medicine, lil' nigga, take some (yeh, yeh)Fast car, NASCAR, race on 'emIn the club, ain't got no ones, then we would beg themClothes from overseas, got the racks and they all C-NotesYou is not a G thoughLookin' at you stackin' all your money, it all green thoughI was countin' that and these all twenties, that's a G-roll[Bridge]She say: ""You're the worst, you're the worst.""I cannot die because this my universe[Chorus]I don't really care if you cryOn the real, you shoulda never liedShoulda saw the way she looked me in my eyesShe said: ""Baby, I am not afraid to die.""Push me to the edgeAll my friends are deadPush me to the edgeAll my friends are deadPush me to the edgeAll my friends are deadPush me to the edge",xo tour llif3
34,"[Intro]Woah-oah, hm-hmm[Verse 1]You've been runnin' 'round, runnin' 'round, runnin' 'roundThrowin' that dirt all on my name'Cause you knew that I, knew that I, knew that I'dCall you upYou've been going 'round, going 'round, going 'roundEvery party in LA'Cause you knew that I, knew that I, knew that I'dBe at one, oh[Pre-Chorus]I know that dress is karma, perfume regretYou got me thinking 'bout when you were mine, oohAnd now I'm all up on ya, what you expect?But you're not coming home with me tonight[Chorus]You just want attention, you don't want my heartMaybe you just hate the thought of me with someone newYeah, you just want attention, I knew from the startYou're just making sure I'm never gettin' over you, oh[Verse 2]You've been runnin' 'round, runnin' 'round, runnin' 'roundThrowin' that dirt all on my name'Cause you knew that I, knew that I, knew that I'dCall you upBaby, now that we're, now that we're, now that we'reRight here standin' face to faceYou already know, 'ready know, 'ready knowThat you won, oh[Pre-Chorus]I know that dress is karma, perfume regretYou got me thinking 'bout when you were mine, oohAnd now I'm all up on ya, what you expect? (oh baby)But you're not coming home with me tonight, oh no[Chorus]You just want attention, you don't want my heartMaybe you just hate the thought of me with someone new (someone new)Yeah, you just want attention (oh), I knew from the start (the start)You're just making sure I'm never gettin' over you (over you), oh[Bridge]What are you doin' to me?What are you doin', huh? (What are you doin'?)What are you doin' to me?What are you doin', huh? (What are you doin'?)What are you doin' to me?What are you doin', huh? (What are you doin'?)What are you doin' to me?What are you doin', huh?[Pre-Chorus]I know that dress is karma, perfume regretYou got me thinking 'bout when you were mineAnd now I'm all up on ya, what you expect?But you're not coming home with me tonight[Chorus]You just want attention, you don't want my heartMaybe you just hate the thought of me with someone newYeah, you just want attention, I knew from the startYou're just making sure I'm never gettin' over you, oh[Bridge]What are you doin' to me? (Hey)What are you doin', huh? (What are you doin', love?)What are you doin' to me?What are you doin', huh? (Yeah, you just want attention)What are you doin' to me? (I knew from the start)What are you doin' huh? (You're just making sure I'm never gettin' over you)What are you doin' to me?What are you doin', huh?",attention
