,lyrics,title
48,"[Verse 1]I buy a new car for the bitch (for real)I tear down the mall with the bitch (for real)You can't even talk to the bitch (no)She fucking with bosses and shit (on God)I pull up in 'Rari's and shit (skrrr)With choppers and Harley's and shit (for real)I be Gucci'd down (Gucci)You wearing Lacoste and shit (bitch)Yeah, Moncler, yuh, fur came off a bear, yuh (yeah)Triple homicide, put me in a chair, yuh (in jail)Triple cross the plug, we do not play fair, yuh (on God)Got 'em tennis chains on and they real blingy (bling)Draco make you do the chicken head like Chingy (Chingy)Walk in Neiman Marcus and I spend a light fifty (fifty)Please proceed with caution, shooters, they be right with me (21)Bad bitch, cute face and some nice titties$7500 on a Saint Laurent jacket (yeah)Bitch, be careful when you dumpin' your ashes (bitch)I ain't no sucker, I ain't cuffin' no action (nah)The skreets raised me, I'm a whole bastard (wild)I bought a 'Rari just so I can go faster (skrrr)Niggas tryna copy me, they playin' catch up (21)I might pull up in a Ghost, no Casper (21)I been smoking gas and I got no asthma[Chorus]I got 1-2-3-4-5-6-7-8 M's in my bank account, yeah (on God)In my bank account, yeah (on God)In my bank account, yeah (on God)In my bank account, yeah (on God)In my bank account, yeah (on God)In my bank account, yeah (on God)I got 1-2-3-4-5-6-7-8 shooters ready to gun you down, yeah (fast)Ready to gun you down, yeah (on God)Ready to gun you down, yeah (on God)Ready to gun you down, yeah (on God)Ready to gun you down, yeah (on God)Ready to gun you down, yeah (on God)[Verse 2]Yeah, dog, huh—yeah—, nah for real, dog (21)Straight up out the 6, now got a house in the Hills, dog (21)Wanna see a body, nigga? Get you killed, dog (wet)Wanna tweet about me, nigga? Get you killed, dog (wet)Killed dog, I'm a real dog—21—, you a lil' dog (21)Be a dog, wanna be a dog, chasing mil's, dog (yeah)Dunk right in your bitch like O'Neal, dog (wet)I shoot like, shoot like Reggie Mill', dog (21)Chopper sting you like a eel, dog (fast)[Chorus]I got 1-2-3-4-5-6-7-8 M's in my bank account, yeah (on God)In my bank account, yeah (on God)In my bank account, yeah (on God)In my bank account, yeah (on God)In my bank account, yeah (on God)In my bank account, yeah (on God)I got 1-2-3-4-5-6-7-8 shooters ready to gun you down, yeah (fast)Ready to gun you down, yeah (on God)Ready to gun you down, yeah (on God)Ready to gun you down, yeah (on God)Ready to gun you down, yeah (on God)Ready to gun you down, yeah (on God)[Verse 3]Ruler clip—umm—, sent a ruler hitPull up on yo' bitch, she say that I got that ruler dickSpray your block down, we not really with that ruh-rah shitGlock cocked now, I don't really give no fuck 'bout who I hitYeah, yo' bitch, she get jiggy with me, keep that Siggy with meBitch, I'm Mad Max, you know I got Ziggy with meKeep a mad mag in case a nigga wanna get busy with me'Rari matte black and I got a Bentley with me[Chorus]I got 1-2-3-4-5-6-7-8 M's in my bank account, yeah (on God)In my bank account, yeah (on God)In my bank account, yeah (on God)In my bank account, yeah (on God)In my bank account, yeah (on God)In my bank account, yeah (on God)I got 1-2-3-4-5-6-7-8 shooters ready to gun you down, yeah (fast)Ready to gun you down, yeah (on God)Ready to gun you down, yeah (on God)Ready to gun you down, yeah (on God)Ready to gun you down, yeah (on God)Ready to gun you down, yeah (on God)[Outro]$7500 on a Saint Laurent jacketBitch, be careful where you dumpin' your ashesI ain't no sucker, I ain't cuffin' no actionThe streets raised me, I'm a whole bastard",bank account
49,"[Verse 1]I don't like your little gamesDon't like your tilted stageThe role you made me playOf the fool, no, I don't like youI don't like your perfect crimeHow you laugh when you lieYou said the gun was mineIsn't cool, no, I don't like you (oh)[Pre-Chorus]But I got smarter, I got harder in the nick of timeHoney, I rose up from the dead, I do it all the timeI've got a list of names and yours is in red, underlinedI check it once, then I check it twice, oh![Chorus]Ooh, look what you made me doLook what you made me doLook what you just made me doLook what you just made me—Ooh, look what you made me doLook what you made me doLook what you just made me doLook what you just made me do[Verse 2]I don't like your kingdom keysThey once belonged to meYou asked me for a place to sleepLocked me out and threw a feast (what?)The world moves on, another day, another drama, dramaBut not for me, not for me, all I think about is karmaAnd then the world moves on, but one thing's for sureMaybe I got mine, but you'll all get yours[Pre-Chorus]But I got smarter, I got harder in the nick of timeHoney, I rose up from the dead, I do it all the timeI've got a list of names and yours is in red, underlinedI check it once, then I check it twice, oh![Chorus]Ooh, look what you made me doLook what you made me doLook what you just made me doLook what you just made me—Ooh, look what you made me doLook what you made me doLook what you just made me doLook what you just made me do[Bridge]I don't trust nobody and nobody trusts meI'll be the actress starring in your bad dreamsI don't trust nobody and nobody trusts meI'll be the actress starring in your bad dreamsI don't trust nobody and nobody trusts meI'll be the actress starring in your bad dreamsI don't trust nobody and nobody trusts meI'll be the actress starring in your bad dreams(Ooh, look what you made me doLook what you made me doLook what you just made me doLook what you just made me—Ooh, look what you made me doLook what you made me doLook what you just made me—)""I'm sorry, the old Taylor can't come to the phone right now""Why? Oh, 'cause she's dead!"" (Oh)[Chorus]Ooh, look what you made me doLook what you made me doLook what you just made me doLook what you just made me—Ooh, look what you made me doLook what you made me doLook what you just made me doLook what you just made me doOoh, look what you made me doLook what you made me doLook what you just made me doLook what you just made me—Ooh, look what you made me doLook what you made me doLook what you just made me doLook what you just made me do",look what you made me do
50,"[Chorus]I can swear, I can jokeI say what's on my mindIf I drink, if I smokeI keep up with the guysAnd you see me holding up my middlefinger to the worldFuck your ribbons and your pearls'Cause I'm not just a pretty girl[Verse 1]I'm more than just a pictureI'm a daughter and a sisterSometimes it's hard for me to showThat I'm more than just a rumorOr a song on your computerThere's more to me than people know[Pre-Chorus]Some days I'm broke, some days I'm richSome days I'm nice, some days I can be a bitchSome days I'm strong, some days I quitI don't let it show, but I've been through some shit[Chorus]I can swear, I can jokeI say what's on my mindIf I drink, if I smokeI keep up with the guysAnd you see me holding up my middlefinger to the worldFuck your ribbons and your pearls'Cause I'm not just a pretty girl[Verse 2]'Cause I'm not just a pretty girlI'm more than just a numberI'm a hater, I'm a loverSometimes it's hard for me to showThat I'm more than just a titleOr a comment going viralThere's more to me than people know[Pre-Chorus]Some days I'm broke, some days I'm richSome days I'm nice, some days I can be a bitchSome days I'm strong, some days I quitI don't let it show, but I've been through some shit[Chorus]I can swear, I can jokeI say what's on my mindIf I drink, if I smokeI keep up with the guysAnd you see me holding up my middlefinger to the worldFuck your ribbons and your pearls'Cause I'm not just a pretty girl, I'm not just a pretty girlI'm not just a pretty girl, no I'm not just a pretty girlI can swear, I can jokeI say what's on my mindIf I drink, if I smokeI keep up with the guysAnd you see me holding up my middlefinger to the worldFuck your ribbons and your pearls'Cause I'm not just a pretty girl, I'm not just a pretty girlI'm not just a pretty girl, no I'm not just a pretty girlI'm not just a pretty girl",pretty girl   cheat codes x cade remix
51,"[Verse 1: Demi Lovato]Cutting me up like a knifeAnd I feel it, deep in my bonesKicking a habit I love even harderYou oughta know[Pre-Chorus: Demi Lovato]I just wanna dive in the water, with youBaby, we can't see the bottomIt's so easy to fall for each otherI'm just hoping we catch one another[Chorus: Trevor Dahl]Oh na na, just be careful, na naLove ain't simple, na naPromise me no promisesOh na na, just be careful, na naLove ain't simple, na naPromise me no promises[Drop: Cheat Codes][Verse 2: Demi Lovato]Baby, I think about youAnd I feel it, deep in my heartMaybe we just ain't meant to be somethingMaybe we are, ooh?[Pre-Chorus: Demi Lovato]I just wanna dive in the water, with youBaby, we can't see the bottomIt's so easy to fall for each otherI'm just hoping we catch one another[Chorus: Trevor Dahl & Demi Lovato]Oh na na, just be careful, na naLove ain't simple, na naPromise me no promisesOh na na, just be careful, na naLove ain't simple, na naPromise me no promises, oh[Drop: Cheat Codes][Bridge: Trevor Dahl & Demi Lovato]I just wanna dive in the waterOh baby, we can't see the bottomI just want to dive in with youI just want to lie here with you, oh[Chorus: Trevor Dahl & Demi Lovato]Oh na na, just be careful, na naLove ain't simple, na naPromise me no promises (promise me)Oh na na, just be careful, na naLove ain't simple, na naPromise me no promises, no[Drop: Cheat Codes][Outro: Trevor Dahl & Demi Lovato]Promise me no promisesDon't you promise me nothingPromise me, me, me, meJust be carefulPromise me no promises",no promises (feat. demi lovato)
52,"[Intro: Quavo]HunchoQuavoYo yo[Verse 1: Liam Payne]You know I've been taking some timeAnd I've been keeping to myself (self)I had my eyes up on the prizeAin't watching anybody elseBut your love, it hit me hard, girlYeah, you're bad for my healthI love the cards that I've been dealtDo you feel the same as well?[Pre-Chorus: Liam Payne & Quavo]You know I used to be in 1D (now I'm out, free)People want me for one thing (that's not me)I'm not changing the way that I (used to be)I just wanna have fun and (get rowdy)One Coke and Bacardi (sippin' lightly)When I walk inside the party (girls on me)F1 type Ferrari (6 gear speed)Girl, I love it when your body (grinds on me)Oh yeah[Chorus: Liam Payne & Quavo]You know I love it when the music's loudBut c'mon, strip that down for me, babyNow there's a lot of people in the crowdBut only you can dance with meSo put your hands on my bodyAnd swing that round for me, baby (swing)You know I love it when the music's loudBut c'mon, strip that down for me (yeah, yeah, yeah, yeah)Oh, strip that down, girlLove when you hit the ground, girl (yeah, yeah, yeah, yeah)Oh, strip that down, girlLove, when you hit the ground[Verse 2: Liam Payne]You know that since the day I met youYeah, you swept me off my feetYou know that I don't need no moneyWhen your love is beside meYeah, you opened up my heartAnd then you threw away the keyGirl, now it's just you and meAnd you don't care 'bout where I've been[Pre-Chorus: Liam Payne & Quavo]You know I used to be in 1D (now I'm out, free)People want me for one thing (that's not me)I'm not changing the way that I (used to be)I just wanna have fun (and get rowdy) (ooh)One Coke and Bacardi (sippin' lightly)When I walk inside the party (girls on me)F1 type Ferrari (6 gear speed)Girl, I love it when your body (grinds on me)Ooh[Chorus: Liam Payne & Quavo]You know I love it when the music's loudBut c'mon, strip that down for me, babyNow there's a lot of people in the crowdBut only you can dance with meSo put your hands on my bodyAnd swing that round for me, baby (yeah)You know I love it when the music's loudBut c'mon, strip that down for me (yeah, yeah, yeah, yeah)Oh, strip that down, girlLove when you hit the ground, girl (yeah, yeah, yeah, yeah) (strip that down)Oh, strip that down, girlLove, when you hit the ground  (yeah, yeah, yeah, yeah)Oh, strip that down, girlLove when you hit the ground, girl  (yeah, yeah, yeah, yeah) (yeah)Oh, strip that down, girlLove, when you hit the ground  (yeah, yeah, yeah, yeah) (ohQuavo)[Verse 3: Quavo]She gon' strip it down for a thug, yeah (strip it down)Word around town she got the buzz, yeah (word)Five shots in, she in love now (shots)I promise, when we pull up, shut the club down (hey)I took her from her man, don't nobody know (know)If you popped the seal, better drive slow (slow)She know how to make me feel with my eyes closed (skrrt skrrt)Anything goes down with the Huncho (Huncho)[Chorus: Liam Payne & Quavo]You know I love it when the music's loudBut c'mon, strip that down for meNow there's a lot of people in the crowdBut only you can dance with meSo put your hands on my bodyAnd swing that round for me, babyYou know I love it when the music's loudBut c'mon, strip that down for me (yeah, yeah, yeah, yeah)Yeah, yeah, yeah, yeah, c'mon, strip that down for me(Yeah, yeah, yeah, yeah) (Ayy)Don't say nothing, girl, strip that down for me (strip it down)(Yeah, yeah, yeah, yeah)All I want, girl, if you strip that down for me (strip it down)(Yeah, yeah, yeah, yeah)You're the one, girl, c'mon, strip that down for me(Yeah, yeah, yeah, yeah)",strip that down
53,"[Verse 1]Hey, hey, heyI got a condo in ManhattanBaby girl, what's  hatnin'?You and your ass invitedSo gon' and get to clappin'So pop it for a playerPop, pop it for meTurn around and drop it for a playerDrop, drop it for meI'll rent a beach house in MiamiWake up with no jammies (Nope)Lobster tail for dinnerJulio serve that scampi (Julio!)You got it if you want itGot, got it if you want itSaid you got it if you want itTake my wallet if you want it now[Pre-Chorus]Jump in the Cadillac, girl, let's put some miles on itAnything you want, just to put a smile on itYou deserve it baby, you deserve it allAnd I'm gonna give it to you[Chorus]Gold jewelry shining so brightStrawberry champagne on iceLucky for you, that's what I like, that's what I likeLucky for you, that's what I like, that's what I likeSex by the fire at nightSilk sheets and diamonds all whiteLucky for you, that's what I like, that's what I likeLucky for you, that's what I like, that's what I like[Verse 2]I'm talkin' trips to Puerto RicoSay the word and we goYou can be my freakaGirl, I'll be a fleeko, mamacitaI will never make a promise that I can't keepI promise that your smile ain't gon' never leaveShopping sprees in ParisEverything 24 karatsTake a look in that mirrorNow tell me who's the fairestIs it you? (is it you?) Is it me? (is it me?)Say it's us (say it's us) and I'll agree, baby[Pre-Chorus]Jump in the Cadillac, girl, let's put some miles on itAnything you want, just to put a smile on itYou deserve it baby, you deserve it allAnd I'm gonna give it to you[Chorus]Gold jewelry shining so brightStrawberry champagne on iceLucky for you, that's what I like, that's what I likeLucky for you, that's what I like, that's what I likeSex by the fire at nightSilk sheets and diamonds all whiteLucky for you, that's what I like, that's what I likeLucky for you, that's what I like, that's what I like[Bridge]If you say you want a good timeWell here I am baby, here I am babyTalk to me, talk to me, talk to meTell me what's on your mind (what's on your mind)If you want it, girl come and get itAll this is here for youTell me baby, tell me, tell me babyWhat you tryna do[Chorus]Gold jewelry shining so brightStrawberry champagne on iceLucky for you, that's what I like, that's what I likeLucky for you, that's what I like, that's what I likeSex by the fire at nightSilk sheets and diamonds all whiteLucky for you, that's what I like, that's what I likeLucky for you, that's what I like, that's what I like",that's what i like
54,"[Chorus: Ariana Grande & Nicki Minaj]I've been here all night, ArianaI've been here all day,  Nicki MinajAnd boy, got me walkin' side to side, let them hoes know[Verse 1: Ariana Grande]I'm talkin' to yaSee you standing over there with your bodyFeeling like I wanna rock with your bodyAnd we don't gotta think 'bout nothin' ('bout nothin')I'm comin' at ya'Cause I know you got a bad reputationDoesn't matter, 'cause you give me temptationAnd we don't gotta think 'bout nothin' ('bout nothin')[Pre-Chorus: Ariana Grande]These friends keep talkin' way too muchSay I should give you upCan't hear them, no, 'cause I…[Chorus: Ariana Grande]I've been here all nightI've been here all dayAnd boy, got me walkin' side to sideI've been here all nightI've been here all dayAnd boy, got me walkin' side to side (side to side)[Verse 2: Ariana Grande]Been tryna hide itBaby, what's it gonna hurt if they don't know?Makin' everybody think that we soloJust as long as you know you got me (you got me)And boy I got yaCause tonight I'm making deals with the devilAnd I know it's gonna get me in troubleJust as long as you know you got me[Pre-Chorus: Ariana Grande]These friends keep talkin' way too muchSay I should give you upCan't hear them, no, 'cause I…[Chorus: Ariana Grande]I've been here all nightI've been here all dayAnd boy, got me walkin' side to side (side to side)I've been here all night (been here all night, baby)I've been here all day (been here all day, baby)And boy, got me walkin' side to side (side to side)[Refrain: Nicki Minaj]This the new style with the fresh type of flowWrist icicle, ride dick, bicycleCome through yo, get you this type of blowIf you wanna Minaj, I got a tricycle[Verse 3: Nicki Minaj]All these bitches' flows is my mini-meBody smoking, so they call me Young Nicki ChimneyRappers in they feelings 'cause they feelin' meUh, I-I give zero fucks and I got zero chill in meKissing me, copped the blue box that say TiffanyCurry with the shot, just tell 'em to call me StephanieGun pop and I make my gum popI'm the queen of rap, young Ariana run pop[Pre-Chorus: Ariana Grande]These friends keep talkin' way too muchSay I should give him upCan't hear them, no, 'cause I…[Chorus: Ariana Grande]I've been here all night (been here all night, baby)I've been here all day (been here all night, baby)And boy, got me walkin' side to side (side to side)I've been here all night (been here all night, baby)I've been here all day (been here all day, baby)Boy, got me walkin' side to side (side to side)[Refrain: Nicki Minaj]This the new style with the fresh type of flowWrist icicle, ride dick, bicycleCome through yo, get you this type of blowIf you wanna Minaj, I got a tricycle",side to side
55,"[Intro: DJ Khaled]Another oneWe The Best musicDJ Khaled[Verse 1: Rihanna]I don't know if you could take itKnow you wanna see me nakey, nakey, nakedI wanna be your baby, baby, babySpinning and it's wet just like it came from MaytagWhite girl wasted on that brown liquorWhen I get like this I can't be around youI'm too lit to dim down a notch'Cause I could name some thangs that I'm gon' do[Chorus: Rihanna]Wild, wild, wildWild, wild, wild thoughtsWild, wild, wildWhen I'm with you, all I get is wild thoughtsWild, wild, wildWhen I'm with you, all I get is wild thoughts[Interlude: DJ Khaled]Let's go![Verse 2: Rihanna]I hope you know I'm for the takin'You know this cookie is for the baking (ugh)Kitty, kitty, baby give that thing some rest'Cause you done beat it like the '68 JetsDiamonds ain't nothing when I'm rockin' with yaDiamonds ain't nothing when I'm shinin' with yaJust keep it white and black as if I'm ya sistaI'm too hip to hop around town out here with yaI know I get[Chorus: Rihanna]Wild, wild, wildWild, wild, wild thoughtsWild, wild, wildWhen I'm with you, all I get is wild thoughtsWild, wild, wildWhen I'm with you, all I get is wild thoughts[Verse 3: Bryson Tiller]Ayy, I heard that pussy for the takingI heard it got these other niggas goin' crazyYeah I treat you like a lady, ladyFuck you 'til you're burned out, cremationMake it cream, yeah, Wu-TangThrow that ass back, bouquetCall me and I can get it juicyI can tell you're gone off the D'USSÉCareful mama watch what you sayYou talking to me like ya new baeGirl, talking like you tryna do thingsNow that pipe got her running like she Usain, babyYou made me drown in it, touche, babyI'm carrying that water, Bobby Boucher, babyYou know I'ma slaughter like I'm JasonBust it, why you got it on safety?White girl wasted on brown liquorI probably shouldn't be around you'Cause you get wild, wild, wildYou looking like there's nothing that you won't doAyy, girl that's when I told you[Chorus: Rihanna]When I'm with you, all I get is wild thoughtsWild, wild, wildWild, wild, wild thoughtsWild, wild, wildWhen I'm with you, all I get is wild thoughtsWild, wild, wildWhen I'm with you, all I get is wild thoughts[Outro: DJ Khaled & Rihanna]DJ Khaled!Wild, wild, wildWild, wild, wildWhen I'm with you, all I get is wild thoughts",wild thoughts
56,"[Verse 1]The club isn't the best place to find a loverSo the bar is where I goMe and my friends at the table doing shotsDrinking fast and then we talk slowAnd you come over and start up a conversation with just meAnd trust me I'll give it a chance nowTake my hand, stop, put Van the Man on the jukeboxAnd then we start to dance, and now I'm singing like[Pre-Chorus]Girl, you know I want your loveYour love was handmade for somebody like meCome on now, follow my leadI may be crazy, don't mind meSay, boy, let's not talk too muchGrab on my waist and put that body on meCome on now, follow my leadCome, come on now, follow my lead[Chorus]I'm in love with the shape of youWe push and pull like a magnet doAlthough my heart is falling tooI'm in love with your bodyAnd last night you were in my roomAnd now my bed sheets smell like youEvery day discovering something brand newI'm in love with your bodyOh—I—oh—I—oh—I—oh—II'm in love with your bodyOh—I—oh—I—oh—I—oh—II'm in love with your bodyOh—I—oh—I—oh—I—oh—II'm in love with your bodyEvery day discovering something brand newI'm in love with the shape of you[Verse 2]One week in we let the story beginWe're going out on our first dateYou and me are thrifty, so go all you can eatFill up your bag and I fill up a plateWe talk for hours and hours about the sweet and the sourAnd how your family is doing okayLeave and get in a taxi, then kiss in the backseatTell the driver make the radio play, and I'm singing like[Pre-Chorus]Girl, you know I want your loveYour love was handmade for somebody like meCome on now, follow my leadI may be crazy, don't mind meSay, boy, let's not talk too muchGrab on my waist and put that body on meCome on now, follow my leadCome, come on now, follow my lead[Chorus]I'm in love with the shape of youWe push and pull like a magnet doAlthough my heart is falling tooI'm in love with your bodyAnd last night you were in my roomAnd now my bed sheets smell like youEvery day discovering something brand newI'm in love with your bodyOh—I—oh—I—oh—I—oh—II'm in love with your bodyOh—I—oh—I—oh—I—oh—II'm in love with your bodyOh—I—oh—I—oh—I—oh—II'm in love with your bodyEvery day discovering something brand newI'm in love with the shape of you[Bridge]Come on, be my baby, come onCome on, be my baby, come onCome on, be my baby, come onCome on, be my baby, come onCome on, be my baby, come onCome on, be my baby, come onCome on, be my baby, come onCome on, be my baby, come on[Chorus]I'm in love with the shape of youWe push and pull like a magnet doAlthough my heart is falling tooI'm in love with your bodyLast night you were in my roomAnd now my bed sheets smell like youEvery day discovering something brand newI'm in love with your bodyCome on, be my baby, come onCome on, be my baby, come onI'm in love with your bodyCome on, be my baby, come onCome on, be my baby, come onI'm in love with your bodyCome on, be my baby, come onCome on, be my baby, come onI'm in love with your bodyEvery day discovering something brand newI'm in love with the shape of you",shape of you
57,"[Verse 1]Where should we run to?We got the world in our hands and we're ready to playThey say we're wastedBut how can we waste it if we're loving every day?Okay, I got the keys to the universeSo stay, with me, 'cause I got the keys, babe[Pre-Chorus]Don't wanna wake up one day wishing that we done moreI wanna live fast and never look back, that's what we here forDon't wanna wake up one day wondering where'd it all go'Cause we'll be home before we know, I wanna hear you sing it[Chorus]Hey mama, don't stress your mind, we coming home tonightHey mama, we gonna be alright, dry those eyesWe'll be back in the morning when the sun starts to riseSo mama, don't stress your mindSo mama, don't stress your mind[Post-Chorus]Mama, mama, mama, heyWe coming home tonightMama, mama, mama, heyWe coming home tonight[Verse 2]Where should we run to?We got a ticket that takes us wherever we likeWe got our problemsBut just for the minute, let's push all our troubles asideAlright, 'cause we got the keys to the universeInside our minds, yeah, we got the keys, babe[Pre-Chorus]Don't wanna wake up one day wishing that we done moreI wanna live fast and never look back, that's what we here forDon't wanna wake up one day wondering where'd it all go'Cause we'll be home before we know, I wanna hear you sing it[Chorus]Hey mama, don't stress your mind, we coming home tonightHey mama, we gonna be alright, dry those eyesWe'll be back in the morning when the sun starts to riseSo mama, don't stress your mindSo mama, don't stress your mindHey, mama, don't stress your mind, we coming home tonightHey, mama, we gonna be alright, dry those eyesWe'll be back in the morning when the sun starts to riseSo mama, don't stress your mindSo mama, don't stress your mind[Post-Chorus]Mama, mama, mama, heyWe coming home tonightMama, mama, mama, heyWe coming home tonight",mama
