,lyrics,title
68,"[Verse 1]It was great at the very startHands on each otherCouldn't stand to be far apartCloser the better[Pre-Chorus]Now we're picking fights and slamming doorsMagnifying all our flawsAnd I wonder why, wonder what forWhy we keep coming back for more[Chorus]Is it just our bodies? Are we both losing our minds?Is the only reason you're holding me tonight'Cause we're scared to be lonely?Do we need somebody just to feel like we're alright?Is the only reason you're holding me tonight'Cause we're scared to be lonely?[Verse 2]Too much time, losing track of usWhere was the real?Undefined, spiraling out of touchForgot how it feels[Pre-Chorus]All the messed up fights and slamming doorsMagnifying all our flawsAnd I wonder why, wonder what forIt's like we keep coming back for more[Chorus]Is it just our bodies? Are we both losing our minds?Is the only reason you're holding me tonight'Cause we're scared to be lonely?Do we need somebody just to feel like we're alright?Is the only reason you're holding me tonight'Cause we're scared to be lonely?[Drop]Scared to be lonely[Bridge]Even when we know it's wrongBeen somebody better for us all alongTell me, how can we keep holding on?Holding on tonight 'cause we're scared to be lonelyEven when we know it's wrongBeen somebody better for us all alongTell me, how can we keep holding on?Holding on tonight 'cause we're scared to be lonely[Chorus]Is it just our bodies? Are we both losing our minds?Is the only reason you're holding me tonight'Cause we're scared to be lonely?[Drop]Scared to be lonelyScared to be lonelyScared to be lonelyEh, eh, scared to be lonely",scared to be lonely
69,"Oh hi, don't know if you know this, there's a lot of rappers out here that been losing focus, kids act like they love itCos they don't know that its bogus I'm reading all the comments and they want me to expose it, oh shit(Verse 1)Telling me that i should dumb it down for the dumber crowd cos they dumber nowGot me feeling like we should hunt them down then go toe to toe for a hundred roundsWait, I didn't mean that, so let me bring it back like a recap, I just wanna feed y'all with these reallyDope bars all you gotta do is hit me with the feedback we back, stronger than ever we never been better at[?]  whatever like I never met her, I know I'm the best I don't know why I'm stepping I'm too busy keeping my head upWait telling me you wanna work was a setup promise that you gon be mad that we met upHungry but you rappers all got me fed up of putting my foot on your neck should i let up, nah, and i never will when i pop-up likeCentre-field then off the beats that you never kill your no allergy and its been a drill so, if you got a Samsung or IphoneHit the share button if you mind blown and dont forget to tag a pinata rapper cos i can beat them down with my eyes closed"" you know, pinata you.. beat it down with your eyes closed? whatever...Real",ispy (feat. lil yachty)
70,"[Intro]TonightI just want to take you higherThrow your hands up in the skyLet's set this party off right[Chorus]Players, put yo' pinky rings up to the moonGirls, what y'all trying to do?24 karat magic in the airHead to toe so playerUh, look out![Verse 1]Pop pop, it's show time (Show time)Show time (Show time)Guess who's back again?Oh they don't know? (Go on tell 'em)Oh they don't know? (Go on tell 'em)I bet they know soon as we walk in (Showin' up)Wearing Cuban links (ya)Designer minks (ya)Inglewood's finest shoes (Whoop, whoop)Don't look too hardMight hurt ya'selfKnown to give the color red the blues[Pre-Chorus]Ooh shit, I'm a dangerous man with some money in my pocket(Keep up)So many pretty girls around me and they waking up the rocket(Keep up)Why you mad? Fix ya faceAin't my fault y'all be jocking(Keep up)[Chorus]Players only, come onPut your pinky rings up to the moonGirls, what y'all trying to do?24 karat magic in the airHead to toe so playerUh, look out![Verse 2]Second verse for the hustlas (hustlas)Gangstas (gangstas)Bad bitches and ya ugly ass friends (Haha)Can I preach? (Uh oh) Can I preach? (Uh oh)I gotta show 'em how a pimp get it inFirst, take your sip (sip), do your dip (dip)Spend your money like money ain't shit (Whoop, whoop)We too freshGot to blame it on JesusHashtag blessedThey ain't ready for me[Pre-Chorus]I'm a dangerous man with some money in my pocket(Keep up)So many pretty girls around me and they waking up the rocket(Keep up)Why you mad? Fix ya faceAin't my fault y'all be jocking(Keep up)[Chorus]Players only, come onPut your pinky rings up to the moonHey girlsWhat y'all trying to do?24 karat magic in the airHead to toe so playerUh, look out![Bridge](Wooh)Everywhere I go they be likeOoh, so player oohEverywhere I go they be likeOoh, so player oohEverywhere I go they be likeOoh, so player oohNow, now, nowWatch me break it down like (Uh)24 karat, 24 karat magicWhat's that sound?24 karat, 24 karat magicCome on now24 karat, 24 karat magicDon't fight the feelingInvite the feeling[Chorus]Just put your pinky rings up to the moonGirls, what y'all trying to do?24 karat magic in the airHead to toe so playerPut your pinky rings up to the moonGirls, what y'all trying to do? (Do)24 karat magic in the airHead to toe so player(24 karat)Uh, look out[Outro](24 karat magic, magic, magic)",24k magic
71,"Letra de ""Súbeme La Radio"" ft. Descemer Bueno & Zion & Lennox[Intro: Enrique Iglesias]Súbeme la radioTrá-tráeme el alcohol[Chorus: Enrique Iglesias & Descemer Bueno]Súbeme la radio que esta es mi canciónSiente el bajo que va subiendoTráeme el alcohol que quita el dolorHoy vamo' a juntar la luna y el sol[Chorus: Enrique Iglesias]Súbeme la radio que esta es mi canciónSiente el bajo que va subiendoTráeme el alcohol que quita el dolorHoy vamo' a juntar la luna y el sol[Verse 1: Enrique Iglesias, Descemer Bueno]Ya no me importa nadaNi el día ni la horaSi lo he perdido todoMe has dejado en las sombrasTe juro que te piensoHago el mejor intentoEl tiempo pasa lentoY yo me voy muriendo(Y yo me voy muriendo)[Verse 2: Zion]Si llega la noche y tú no contestasTe juro me quedo esperando a tu puertaVivo pasando las noches en velaY sigo cantando bajo la luna llena[Chorus: Enrique Iglesias & Descemer Bueno]Súbeme la radio que esta es mi canciónSiente el bajo que va subiendoTráeme el alcohol que quita el dolorHoy vamo' a juntar la luna y el sol[Chorus: Enrique Iglesias]Súbeme la radio que esta es mi canciónSiente el bajo que va subiendoTráeme el alcohol que quita el dolorHoy vamo' a juntar la luna y el sol[Verse 3: Descemer Bueno]Huyendo del pasadoEn cada madrugadaNo encuentro ningún modoDe borrar nuestra historiaA su salud bebiendo(A su salud bebiendo)Mientras me quede aliento(Mientras me quede aliento)Sólo le estoy pidiendo(Sólo te estoy pidiendo)Romper este silencio(Romper este silencio)[Chorus: Enrique Iglesias & Descemer Bueno]Súbeme la radio que esta es mi canciónSiente el bajo que va subiendoTráeme el alcohol que quita el dolorHoy vamo' a juntar la luna y el sol[Chorus: Enrique Iglesias]Súbeme la radio que esta es mi canciónSiente el bajo que va subiendoTráeme el alcohol que quita el dolorHoy vamo' a juntar la luna y el sol[Verse 4: Lennox]Ando loco y desesperado en busca de tu amorNo me dejes en esta soledad te pidoNena te digo, vuelve conmigoSi tú me llamas, te juro que pa' allá voy yoQuiero verte yaYa no aguanto másQuiero darte calorSolo una vez másYa no aguanto másQuiero verte ya, hoy[Bridge: Enrique Iglesias]Yo no te mientoTodavía te esperoSabes bien que te quieroNo sé vivir sin tiYo no te mientoTodavía te esperoSabes bien que te quieroNo sé vivir sin ti[Chorus: Enrique Iglesias & Descemer Bueno]Súbeme la radio que esta es mi canciónSiente el bajo que va subiendoTráeme el alcohol que quita el dolorHoy vamo' a juntar la luna y el sol[Chorus: Enrique Iglesias]Súbeme la radio que esta es mi canciónSiente el bajo que va subiendoTráeme el alcohol que quita el dolorHoy vamo' a juntar la luna y el sol[Outro: Enrique Iglesias]Súbeme la radioTráeme el alcoholSúbeme la radio",subeme la radio
72,"Letra de ""Me Rehúso""[Intro]Ba-Ba-Babylon girl, Ba-Ba-Babylon girlPara todos aquellos amores que, que fueron obligados a ser separadosBa-Ba-Babylon girl, Ba-Ba-Babylon girlEsta canción es para ti[Verso 1]Dime cómo le explico a mi destino que ya no estás ahíDime cómo haré para desprenderme de este frenesíEsta locura que siento por tiCon esta química que haces en míY ya no puedo, girl, ya no puedo, girl[Pre-Coro]Nena discúlpame si te ilusioné yo no lo quise hacerSé que en el amor cuando es real ese vuelve, vuelve (vuelve, vuelve)Pero cómo olvidar tu piel y cómo olvidarte mujerYa no puedo, girl, ya no puedo, girl[Coro]Baby, no (baby, no)Me rehúso a darte un último beso así que guárdalo (guárdalo)Para que la próxima vez te lo dé haciéndolo (haciéndolo)Haciéndotelo así, así, asíAsí como te gusta, baby[Verso 2]Sin mirar atrás, sin buscar a nadie másSólo quiero estar contigo, wouhSi no te tengo aquí conmigo yo no quiero ser tu amigoPorque tú eres mi camino, wouhY yo sólo quiero estar junto a tiNena, por favor entiéndeloSólo dame tu mano y confía en míSi te pierdes sólo sigue mi vozY dale tiempo (tiempo), mami, al tiempo (tiempo)Que tú, que yo, estamos hechos para estar los dosY dale tiempo (tiempo), baby, al tiempo (tiempo)Que tú y yo, que tú y yoEstamos hechos para estar los dos[Coro]Baby, no (baby, no)Me rehúso a darte un último beso así que guárdalo (guárdalo)Para que la próxima vez te lo dé haciéndolo (haciéndolo)Haciéndotelo así, así, asíAsí como te gusta, babyBaby, noMe rehúso a darte un último beso así que guárdalo (guárdalo)Para que la próxima vez te lo dé haciéndoloHaciéndotelo así, así, asíAsí como te gusta, baby[Bridge]Así, así, así como te gusta, baby[Coro]Baby noBaby, no (baby, no)Me rehúso a darte un último beso así que guárdalo (guárdalo)Para que la próxima vez te lo dé haciéndoloHaciéndotelo así, así, asíAsí como te gusta babyY baby, no (baby, no)Me rehúso a darte un último beso así que guárdalo (guárdalo)Para que la próxima vez te lo dé haciéndoloHaciéndotelo así, asíAsí como te gusta baby",me rehúso
73,"[Verse 1]Yeah, I'd rather be a lover than a fighter (fighter)'Cause all my life, I've been fightingNever felt a feeling of comfortAll this time, I've been hidingAnd I never had someone to call my own, oh nahI'm so used to sharingLove only left me aloneBut I'm at one with the silence[Chorus]I found peace in your violenceCan't tell me there's no point in tryingI'm at one, and I've been quiet for too longI found peace in your violenceCan't tell me there's no point in tryingI'm at one, and I've been silent for too long[Drop]I've been quiet for too longI've been quiet for too longI found peace in your violenceCan't tell me there's no point in tryingI'm at one, and I've been quiet for too long[Verse 2]I'm in need of a savior, but I'm not asking for favorsMy whole life, I've felt like a burdenI think too much, and I hate itI'm so used to being in the wrong, I'm tired of caringLoving never gave me a home, so I'll sit here in the silence[Chorus]I found peace in your violenceCan't tell me there's no point in tryingI'm at one, and I've been quiet for too longI found peace in your violenceCan't tell me there's no point in tryingI'm at one, and I've been silent for too long[Drop]I've been quiet for too longI've been quiet for too longI found peace in your violenceCan't tell me there's no point in tryingI'm at one, and I've been quiet for too long",silence
74,"[Verse 1: Chris Martin]I've been reading books of oldThe legends and the mythsAchilles and his goldHercules and his giftsSpiderman's controlAnd Batman with his fistsAnd clearly I don't see myself upon that list[Pre-Chorus: Chris Martin]But she said, where'd you wanna go?How much you wanna risk?I'm not looking for somebodyWith some superhuman giftsSome superheroSome fairytale blissJust something I can turn toSomebody I can kiss[Bridge: Chris Martin]I want something just like thisDoo-doo-doo, doo-doo-dooDoo-doo-doo, doo-dooDoo-doo-doo, doo-doo-dooOh, I want something just like thisDoo-doo-doo, doo-doo-dooDoo-doo-doo, doo-dooDoo-doo-doo, doo-doo-doo[Chorus: Chris Martin]Oh, I want something just like thisI want something just like this[Verse 2: Chris Martin]I've been reading books of oldThe legends and the mythsThe testaments they toldThe moon and its eclipseAnd Superman unrollsA suit before he liftsBut I'm not the kind of person that it fits[Pre-Chorus: Chris Martin]She said, where'd you wanna go?How much you wanna risk?I'm not looking for somebodyWith some superhuman giftsSome superheroSome fairytale blissJust something I can turn toSomebody I can miss[Chorus: Chris Martin]I want something just like thisI want something just like this[Bridge: Chris Martin]Oh, I want something just like thisDoo-doo-doo, doo-doo-dooDoo-doo-doo, doo-dooDoo-doo-doo, doo-doo-dooOh, I want something just like thisDoo-doo-doo, doo-doo-dooDoo-doo-doo, doo-dooDoo-doo-doo, doo-doo-doo[Pre-Chorus: Chris Martin]Where'd you wanna go?How much you wanna risk?I'm not looking for somebodyWith some superhuman giftsSome superheroSome fairytale blissJust something I can turn toSomebody I can kissI want something just like this[Chorus: Chris Martin]Oh, I want something just like thisOh, I want something just like thisOh, I want something just like this",something just like this
75,,escápate conmigo
76,"[Verse 1]To be young and in love in New York CityTo not know who I am but still know that I'm good long as you're here with meTo be drunk and in love in New York CityMidnight into morning coffee, burning through the hours talkingDamn[Chorus]I like me better when I'm with youI like me better when I'm with youI knew from the first time, I'd stay for a long time, 'causeI like me better when, I like me better when I'm with you[Verse 2]I don't know what it is but I got that feelingWaking up in this bed next to you swear the room, yeah, it got no ceilingIf we lay, let the day just pass us byI might get to too much talking, I might have to tell you somethingDamn[Chorus]I like me better when I'm with youI like me better when I'm with youI knew from the first time, I'd stay for a long time, 'causeI like me better when, I like me better when I'm with you[Bridge]Stay awhile, stay awhileStay here with meStay awhile, stay awhile, ohStay awhile, stay awhileStay here with meLay here with me, ooh[Chorus]I like me better when I'm with you (yes I do, yes I do, babe)I like me better when I'm with you (oooh noo)I knew from the first time, I'd stay for a long time, 'causeI like me better when, I like me better when I'm with you[Outro](I like me, I like me)(Look who you made me, made me, oh noo)Better whenI like me better when I'm with you",i like me better
77,"[Intro]BloodPop®[Verse 1]I was wonderin' 'bout your mamaDid she get that job she wanted?Sell that car that gave her problems?I'm just curious 'bout her, honest (ooh-ooh)[Pre-Chorus]Know you're wonderin' why I been callin'Like I got ulterior motivesKnow we didn't end this so goodBut you know we had something so good[Chorus]So I'm wonderin'Can we still be friends? (ah-ah)Can we still be friends? (ah-ah)Doesn't have to end (ah-ah)And if it ends, can we be friends?Can we be friends?Can we be friends?[Verse 2]Wonderin' if you got a bodyTo hold you tighter since I left (since I left)Wonderin' if you think about me (uh-huh)Actually, don't answer that (uh-huh)[Pre-Chorus]Know you're wonderin' why I been callin'Like I got ulterior motivesKnow we didn't end this so goodBut you know we had something so good[Chorus]So I'm wonderin'Can we still be friends? (ah-ah)Can we still be friends? (ah-ah)Doesn't have to end (ah-ah)And if it ends, can we be friends?Can we be friends?Can we be friends?And if it ends, can we be friends?[Pre-Chorus]Know you're wonderin' why I been callin'Like I got ulterior motivesKnow we didn't end this so goodBut you know we had something so good[Chorus]I'm wonderin'Can we still be friends? (ah-ah)Can we still be friends? (ah-ah)Doesn't have to end (ah-ah)And if it ends, can we be friends?",friends (with bloodpop®)
78,"[Intro]Payback is a bad bitchAnd baby, I'm the baddest(I'm the baddest, I'm the baddest...)Go[Verse 1]Now, I'm out here lookin' like revengeFeelin' like a ten, the best I've ever beenAnd, yeah, I know how bad it must hurt to see me like thisBut it gets worse (wait a minute)Now, you're out here lookin' like regret, ain't too proud to begSecond chance, you'll never getAnd, yeah, I know how bad it must hurt to see me like thisBut it gets worse (wait a minute)[Pre-Chorus]Now, payback is a bad bitchAnd baby, I'm the baddestYou fuckin' with a savageCan't have this, can't have this (ah)And it'd be nice of me to take it easy on ya, but nah[Chorus]Baby, I'm sorry (I'm not sorry)Baby, I'm sorry (I'm not sorry)Bein' so bad got me feelin' so goodShowin' you up like I knew that I wouldBaby, I'm sorry (I'm not sorry)Baby, I'm sorry (I'm not sorry)Feelin' inspired 'cause the tables have turnedYeah, I'm on fire and I know that it burns[Verse 2]Baby, fineness is the way to killTell me how it feel, bet it's such a bitter pillAnd yeah I know, you thought you had bigger, better thingsBet right now this stings (wait a minute)'Cause the grass is greener under meBright as Technicolor, I can tell that you can seeAnd yeah, I know how bad it must hurt to see me like thisBut it gets worse (wait a minute)[Pre-Chorus]Now, payback is a bad bitchAnd baby, I'm the baddestYou fuckin' with a savageCan't have this, can't have this (ah)And it'd be nice of me to take it easy on ya, but nah[Chorus]Baby, I'm sorry (I'm not sorry)Baby, I'm sorry (I'm not sorry)Bein' so bad got me feelin' so goodShowin' you up like I knew that I wouldBaby, I'm sorry (I'm not sorry)Baby, I'm sorry (I'm not sorry)Feelin' inspired 'cause the tables have turnedYeah, I'm on fire and I know that it burns[Bridge]Talk that talk, babyBetter walk, better walk that walk, babyIf you talk, if you talk that talk, babyBetter walk, better walk that walk, babyOh, yeah, talk that talk, babyBetter walk, better walk, that walk, babyIf you talk, if you talk that talk, babyBetter walk, better walk that walk, baby[Chorus]Baby, I'm sorry (I'm not sorry)Baby, I'm sorry (I'm not sorry)Bein' so bad got me feelin' so goodShowin' you up like I knew that I wouldBaby, I'm sorry (I'm not sorry)Baby, I'm sorry (I'm not sorry)Feelin' inspired 'cause the tables have turnedYeah, I'm on fire and I know that it burns[Outro]Payback is a bad bitchAnd baby, I'm the baddestI'm the baddest, I'm the baddest",sorry not sorry
79,"Letra de ""Ahora Dice"" ft. J Balvin, Ozuna & Arcángel[Pre-Intro]Baby, Chris Jeday (Chris Jeday)Austin Baby, J Balvin, manOzuna, baby (Ozuna)[Intro: Arcángel]No quieres saber na' de míDime que fue lo que yo hice malTe pusieron en contra de míAl que fue no se la vo' a perdonar[Coro: Ozuna & J Balvin]Ahora dice que no me conoce, no, no, no, no, noY si me ha visto se supone, que en el pasado fueYo sí me acuerdo cómo lo hacíamosCómo en la cama nos matábamosAhora dice que no me conoce, no, no, no, no, noY si me ha visto se supone, que en el pasado fueYo sí me acuerdo cómo lo hacíamosCómo en la cama nos matábamos[Verso 1: Ozuna]Sé que te pasas negandoTo' lo que tú y yo hacíamosQueda en tu mente grabadoTodas las veces que nos desvestíamosAhora me paso pensandoCómo tú puedes vivir asíDiciendo que noSabiendo que, entre sábanas, tú te entragaba' a míSólo yo he podido llegarleTu cuerpo sabe elevarseY cuando tus piernas temblabanNo decías nada, ya noY ahora que ando con el dineroNo quiero interrupcionesDesde la prioridadPasaste a lista de opcionesEstoy con la colombiana que se va mañanaY la cubana llega a ParísLlámate al ruso que baje los kilos de oroQue llega en la tarde a Brasil[Pre-coro: J Balvin]Sólo yo he podido llegarleTu cuerpo sabe elevarseY cuando tus piernas temblabanNo decías nada, nada, no, no[Coro: Ozuna & Arcángel]Ahora dice que no me conoce, no, no, no, no, noY si me ha visto se supone, que en el pasado fueYo sí me acuerdo cómo lo hacíamosCómo en la cama nos matábamosY ahora dice que no me conoce, no, no, no, no, noY si me ha visto se supone, que en el pasado fueYo sí me acuerdo cuando lo hacíamosCuando en la cama nos matábamos[Verso 2: J Balvin](J Balvin, man)Po-po-por más que me niegues a mí, no puedes escaparteSi yo era tu luz, tú, mi sombra y me seguías a todas partesNos lograron separar (ayy), tú no quisiste escuchar (ayy)Fue más importante qué dijo la gente que a dónde podíamos llegarEn el mundo de mí están hablando, diciendo mil cosasQue me ven por aquí, que me ven por allá, por mi vida famosaTú me conoces de años atrás, sabes cómo es la cosa (cosa)Tú sabes que yo soy real, te lo dije una vezPensé que nuestro amor es periódico de ayerQue tú no lo quieres leer, que ni por la calle tú me quieres verSi sales de party, me escuchas a míSiempre te preguntan por mí, baby¿Dime qué se siente ser el fantasma que te atormenta a ti?[Verso 3: Arcángel]Dime qué pasó, mami, todo iba normalTe hablaron de mí, te dejaste llevarTu cuerpo me estaba empezando a amarY por culpa de la gente ahora te toca olvidarYo sé que eres infeliz pero te pasas mintiendoFingiendo que eres feliz, mami, yo no te entiendoAhora él te pone a llorar, también te pone a sufrirMientras yo te ponía a viajar, bien linda te hacía lucir[Pre-coro: Arcángel]Sólo yo he podido llegarleTu cuerpo sabe elevarseY cuando tus piernas temblabanNo me decían nada, nada, nada, nada[Coro: Ozuna, Arcángel &  J Balvin ]Ahora dice que no me conoce, no, no, no, no, noY si me ha visto se supone, que en el pasado fueYo sí me acuerdo cómo lo hacíamosCómo en la cama nos matábamosAhora dice que no me conoce, no, no, no, no, noY si me ha visto se supone, que en el pasado fueYo sí me acuerdo cómo lo hacíamosCómo en la cama nos matábamos[Outro: J Balvin]J Balvin, manOzuna (Ozuna, man)OzunaArca, men (Austin, baby)Así es como esChris JedayAhora dice, dice, diceAhora dice, dice, dice",ahora dice
80,"[Verse 1: Macklemore]You know I'm back like I never leftAnother sprint, another stepAnother day, another breathBeen chasing dreams, but I never sleptI got a new attitude and a lease on lifeAnd some peace of mindSeek and I find I can sleep when I dieWanna piece of the pie, grab the keys to the rideAnd shit I'm straightI'm on my wave, I'm on my waveGet out my wake, I'm running late, what can I say?I heard you die twice, once when they bury you in the graveAnd the second time is the last time that somebody mentions your nameSo when I leave here on this earth, did I take more than I gave?Did I look out for the people or did I do it all for fame?Legend it's exodus searching for euphoriaTrudging through the mud to find the present, no ignoring usGot 20,000 deep off in the street like we some warriorsMy mama told me never bow your head, woo![Chorus: Skylar Grey]I feel glorious, gloriousGot a chance to start againI was born for this, born for thisIt's who I am, how could I forget?I made it through the darkest part of the nightAnd now I see the sunriseNow I feel glorious, gloriousI feel glorious, glorious[Verse 2: Macklemore]I'm feeling gloriousThe crib looking Victorian (oh yes it is)You know that we been going inSince we hopped out that Delorean (Delorean, yeah we win)En garde, things are just thingsThey don't make you who you areCan't pack up a U-Haul and take it with you when you're goneWe posted on the porch, my family's glasses to the starsMy grandma smiling down on me like woo, that boy got barsOkay, okay, yes I doI said amen and hallelujah, let me testify tooAnother morning, a morning, don't let self get in my wayI got my breath, I got my faith and I remember why I came[Chorus: Skylar Grey]I feel glorious, gloriousGot a chance to start againI was born for this, born for thisIt's who I am, how could I forget?I made it through the darkest part of the nightAnd now I see the sunriseNow I feel glorious, gloriousI feel glorious, glorious[Bridge: Skylar Grey]We gon' be alright, put that on my lifeWhen I open my eyes, hope I see you shineWe're planting a flag they don't understandThe world is up for grabsWe gon' be alright, put that on my lifeWhen I open my eyes, hope I see you shineWe're planting a flag they don't understandThe world is up for grabs[Chorus: Skylar Grey]I feel glorious, gloriousGot a chance to start againI was born for this, born for thisIt's who I am, how could I forget?I made it through the darkest part of the nightAnd now I see the sunriseNow I feel glorious, gloriousI feel glorious, glorious",glorious (feat. skylar grey)
